### ISSUE TITLE
bug: BirdNET-Go requests both video and audio streams from RTSP camera

### ISSUE THREAD

**Issue by inventor7777** [tphakala/birdnet-go#3798]
### BirdNET-Go version / build date

nightly-20260615

### Install method

Home Assistant add-on (community, third-party)

### Device type

PC / Server (x86_64)

### Operating system and version

HAOS Linux

### Audio source

Network audio stream - RTSP / RTSPS (e.g. IP camera)

### Hardware details

- RAM: 16GB
- CPU: i7-7700T
- Storage: 256GB NVMe
- Camera: Reolink Duo 3V PoE

----

### Description

When using RTSP in BirdNET-Go, it explicitly requests the video stream from the camera as well, even though video is never used. This causes unnecessary camera CPU/network usage and consumes one video client on cameras with limited RTSP sessions.

### Steps to reproduce

1. Add RTSP camera as audio source
2. Start stream
3. Observe RTSP bandwidth and/or `tcpdump`

### Expected behaviour

The built in ffmpeg/lavf should only request the audio. Whether this should be automatic or user-selectable...that's up to you guys.

### Actual behaviour

BirdNET requests both audio and video from the camera, even though video is not being used.

### When did this start?

First time setting up BirdNET-Go (never worked)

### Relevant log output

Nothing from BirdNET logs. See below for `tcpdump` logs.

### RTSP source (only if the bug is RTSP related)

- Reolink Duo 3V PoE
- `rtsp://admin:myredactedpass@192.168.50.23:554/h264Preview_01_sub` in TCP mode

### Pre-submission checks

- [x] I am running the [latest release](https://github.com/tphakala/birdnet-go/releases) or have tested with the `:dev` container image.
- [x] I have searched existing open and closed issues and this does not appear to be a duplicate.

### tcpdump

```
root@HAOS-M710q - 18:35 /root # sudo tcpdump -i enp0s31f6 -nn -v 'host 192.168.50.23 and tcp port 554'
tcpdump: listening on enp0s31f6, link-type EN10MB (Ethernet), snapshot length 262144 bytes
18:35:20.051747 IP (tos 0x0, ttl 63, id 46406, offset 0, flags [DF], proto TCP (6), length 60)
    192.168.50.3.55448 > 192.168.50.23.554: Flags [S], cksum 0xe599 (incorrect -> 0xf25e), seq 3684805201, win 64240, options [mss 1460,sackOK,TS val 2058721750 ecr 0,nop,wscale 10], length 0
18:35:20.052804 IP (tos 0x0, ttl 64, id 0, offset 0, flags [DF], proto TCP (6), length 60)
    192.168.50.23.554 > 192.168.50.3.55448: Flags [S.], cksum 0xa057 (correct), seq 289130219, ack 3684805202, win 65160, options [mss 1460,sackOK,TS val 3825242683 ecr 2058721750,nop,wscale 5], length 0
18:35:20.052858 IP (tos 0x0, ttl 63, id 46407, offset 0, flags [DF], proto TCP (6), length 52)
    192.168.50.3.55448 > 192.168.50.23.554: Flags [.], cksum 0xe591 (incorrect -> 0xcd69), ack 1, win 63, options [nop,nop,TS val 2058721752 ecr 3825242683], length 0
18:35:20.052877 IP (tos 0x0, ttl 63, id 46408, offset 0, flags [DF], proto TCP (6), length 151)
    192.168.50.3.55448 > 192.168.50.23.554: Flags [P.], cksum 0xe5f4 (incorrect -> 0x5921), seq 1:100, ack 1, win 63, options [nop,nop,TS val 2058721752 ecr 3825242683], length 99: RTSP, length: 99
	OPTIONS rtsp://192.168.50.23:554/h264Preview_01_sub RTSP/1.0
	CSeq: 1
	User-Agent: Lavf61.7.102
	
18:35:20.053788 IP (tos 0x0, ttl 64, id 26062, offset 0, flags [DF], proto TCP (6), length 52)
    192.168.50.23.554 > 192.168.50.3.55448: Flags [.], cksum 0xc552 (correct), ack 100, win 2034, options [nop,nop,TS val 3825242684 ecr 2058721752], length 0
18:35:20.054305 IP (tos 0x0, ttl 64, id 26063, offset 0, flags [DF], proto TCP (6), length 204)
    192.168.50.23.554 > 192.168.50.3.55448: Flags [P.], cksum 0x9080 (correct), seq 1:153, ack 100, win 2034, options [nop,nop,TS val 3825242684 ecr 2058721752], length 152: RTSP, length: 152
	RTSP/1.0 200 OK
	CSeq: 1
	Date: Mon, Jul 06 2026 23:35:20 GMT
	Public: OPTIONS, DESCRIBE, SETUP, TEARDOWN, PLAY, PAUSE, GET_PARAMETER, SET_PARAMETER
	
18:35:20.054324 IP (tos 0x0, ttl 63, id 46409, offset 0, flags [DF], proto TCP (6), length 52)
    192.168.50.3.55448 > 192.168.50.23.554: Flags [.], cksum 0xe591 (incorrect -> 0xcc6c), ack 153, win 63, options [nop,nop,TS val 2058721753 ecr 3825242684], length 0
18:35:20.054607 IP (tos 0x0, ttl 63, id 46410, offset 0, flags [DF], proto TCP (6), length 177)
    192.168.50.3.55448 > 192.168.50.23.554: Flags [P.], cksum 0xe60e (incorrect -> 0x2a4e), seq 100:225, ack 153, win 63, options [nop,nop,TS val 2058721753 ecr 3825242684], length 125: RTSP, length: 125
	DESCRIBE rtsp://192.168.50.23:554/h264Preview_01_sub RTSP/1.0
	Accept: application/sdp
	CSeq: 2
	User-Agent: Lavf61.7.102
	
18:35:20.055487 IP (tos 0x0, ttl 64, id 26064, offset 0, flags [DF], proto TCP (6), length 222)
    192.168.50.23.554 > 192.168.50.3.55448: Flags [P.], cksum 0x0143 (correct), seq 153:323, ack 225, win 2031, options [nop,nop,TS val 3825242685 ecr 2058721753], length 170: RTSP, length: 170
	RTSP/1.0 401 Unauthorized
	CSeq: 2
	Date: Mon, Jul 06 2026 23:35:20 GMT
	WWW-Authenticate: Digest realm="BC Streaming Media", nonce="97902c7e7b022ba297f954af5077011c"
	
18:35:20.055894 IP (tos 0x0, ttl 63, id 46411, offset 0, flags [DF], proto TCP (6), length 383)
    192.168.50.3.55448 > 192.168.50.23.554: Flags [P.], cksum 0xe6dc (incorrect -> 0x2c0a), seq 225:556, ack 323, win 63, options [nop,nop,TS val 2058721755 ecr 3825242685], length 331: RTSP, length: 331
	DESCRIBE rtsp://192.168.50.23:554/h264Preview_01_sub RTSP/1.0
	Accept: application/sdp
	CSeq: 3
	User-Agent: Lavf61.7.102
	Authorization: Digest username="admin", realm="BC Streaming Media", nonce="97902c7e7b022ba297f954af5077011c", uri="rtsp://192.168.50.23:554/h264Preview_01_sub", response="51826a284fedaeab7137ac06ad244a14"
	
18:35:20.090113 IP (tos 0x0, ttl 64, id 26065, offset 0, flags [DF], proto TCP (6), length 910)
    192.168.50.23.554 > 192.168.50.3.55448: Flags [P.], cksum 0xd203 (correct), seq 323:1181, ack 556, win 2021, options [nop,nop,TS val 3825242720 ecr 2058721755], length 858: RTSP, length: 858
	RTSP/1.0 200 OK
	CSeq: 3
	Date: Mon, Jul 06 2026 23:35:20 GMT
	Content-Base: rtsp://192.168.50.23/Preview_01_sub/
	Content-Type: application/sdp
	Content-Length: 689
	
	v=0
	o=- 1783234861310197 1 IN IP4 192.168.50.23
	s=Session streamed by "preview"
	i=reolink rtsp stream
	t=0 0
	a=tool:Reolink Streaming Media 2024.12.11
	a=type:broadcast
	a=control:*
	a=range:npt=now-
	a=x-qt-text-nam:Session streamed by "preview"
	m=video 0 RTP/AVP 96
	c=IN IP4 0.0.0.0
	b=AS:8192
	a=rtpmap:96 H264/90000
	a=fmtp:96 packetization-mode=1;profile-level-id=640033;sprop-parameter-sets=Z2QAM6wTEqBgDeQ=,aO48sA==
	a=recvonly
	a=control:track1
	m=audio 0 RTP/AVP 97
	c=IN IP4 0.0.0.0
	b=AS:8192
	a=rtpmap:97 MPEG4-GENERIC/16000
	a=fmtp:97 streamtype=5;profile-level-id=1;mode=AAC-hbr;sizelength=13;indexlength=3;indexdeltalength=3;config=1408
	a=recvonly
	a=control:track2
18:35:20.091083 IP (tos 0x0, ttl 63, id 46412, offset 0, flags [DF], proto TCP (6), length 401)
    192.168.50.3.55448 > 192.168.50.23.554: Flags [P.], cksum 0xe6ee (incorrect -> 0x7915), seq 556:905, ack 1181, win 63, options [nop,nop,TS val 2058721790 ecr 3825242720], length 349: RTSP, length: 349
	SETUP rtsp://192.168.50.23/Preview_01_sub/track1 RTSP/1.0
	Transport: RTP/AVP/TCP;unicast;interleaved=0-1
	CSeq: 4
	User-Agent: Lavf61.7.102
	Authorization: Digest username="admin", realm="BC Streaming Media", nonce="97902c7e7b022ba297f954af5077011c", uri="rtsp://192.168.50.23/Preview_01_sub/track1", response="6be43eda5924626b84e08480a7a68ef0"
	
18:35:20.132544 IP (tos 0x0, ttl 64, id 26066, offset 0, flags [DF], proto TCP (6), length 241)
    192.168.50.23.554 > 192.168.50.3.55448: Flags [P.], cksum 0xfb3c (correct), seq 1181:1370, ack 905, win 2011, options [nop,nop,TS val 3825242762 ecr 2058721790], length 189: RTSP, length: 189
	RTSP/1.0 200 OK
	CSeq: 4
	Date: Mon, Jul 06 2026 23:35:20 GMT
	Transport: RTP/AVP/TCP;unicast;destination=192.168.50.3;source=192.168.50.23;interleaved=0-1
	Session: 620A8D7E;timeout=30
	
18:35:20.133419 IP (tos 0x0, ttl 63, id 46413, offset 0, flags [DF], proto TCP (6), length 420)
    192.168.50.3.55448 > 192.168.50.23.554: Flags [P.], cksum 0xe701 (incorrect -> 0x1a88), seq 905:1273, ack 1370, win 63, options [nop,nop,TS val 2058721832 ecr 3825242762], length 368: RTSP, length: 368
	SETUP rtsp://192.168.50.23/Preview_01_sub/track2 RTSP/1.0
	Transport: RTP/AVP/TCP;unicast;interleaved=2-3
	CSeq: 5
	User-Agent: Lavf61.7.102
	Session: 620A8D7E
	Authorization: Digest username="admin", realm="BC Streaming Media", nonce="97902c7e7b022ba297f954af5077011c", uri="rtsp://192.168.50.23/Preview_01_sub/track2", response="54f1145769078e6ed06df32218001b37"
	
18:35:20.135543 IP (tos 0x0, ttl 64, id 26067, offset 0, flags [DF], proto TCP (6), length 241)
    192.168.50.23.554 > 192.168.50.3.55448: Flags [P.], cksum 0xf4e9 (correct), seq 1370:1559, ack 1273, win 2003, options [nop,nop,TS val 3825242765 ecr 2058721832], length 189: RTSP, length: 189
	RTSP/1.0 200 OK
	CSeq: 5
	Date: Mon, Jul 06 2026 23:35:20 GMT
	Transport: RTP/AVP/TCP;unicast;destination=192.168.50.3;source=192.168.50.23;interleaved=2-3
	Session: 620A8D7E;timeout=30
	
18:35:20.136415 IP (tos 0x0, ttl 63, id 46414, offset 0, flags [DF], proto TCP (6), length 378)
    192.168.50.3.55448 > 192.168.50.23.554: Flags [P.], cksum 0xe6d7 (incorrect -> 0xc0a3), seq 1273:1599, ack 1559, win 63, options [nop,nop,TS val 2058721835 ecr 3825242765], length 326: RTSP, length: 326
	PLAY rtsp://192.168.50.23/Preview_01_sub/ RTSP/1.0
	Range: npt=0.000-
	CSeq: 6
	User-Agent: Lavf61.7.102
	Session: 620A8D7E
	Authorization: Digest username="admin", realm="BC Streaming Media", nonce="97902c7e7b022ba297f954af5077011c", uri="rtsp://192.168.50.23/Preview_01_sub/", response="367cf2e117f91dad13bcf4df94351ef1"
	
18:35:20.138199 IP (tos 0x0, ttl 64, id 26068, offset 0, flags [DF], proto TCP (6), length 56)
    192.168.50.23.554 > 192.168.50.3.55448: Flags [P.], cksum 0x949c (correct), seq 1559:1563, ack 1599, win 2003, options [nop,nop,TS val 3825242768 ecr 2058721835], length 4: RTSP
18:35:20.178721 IP (tos 0x0, ttl 63, id 46415, offset 0, flags [DF], proto TCP (6), length 52)
    192.168.50.3.55448 > 192.168.50.23.554: Flags [.], cksum 0xe591 (incorrect -> 0xc03e), ack 1563, win 63, options [nop,nop,TS val 2058721878 ecr 3825242768], length 0
18:35:20.179888 IP (tos 0x0, ttl 64, id 26069, offset 0, flags [DF], proto TCP (6), length 479)
    192.168.50.23.554 > 192.168.50.3.55448: Flags [P.], cksum 0x084a (correct), seq 1563:1990, ack 1599, win 2003, options [nop,nop,TS val 3825242810 ecr 2058721878], length 427: RTSP
18:35:20.179927 IP (tos 0x0, ttl 63, id 46416, offset 0, flags [DF], proto TCP (6), length 52)
    192.168.50.3.55448 > 192.168.50.23.554: Flags [.], cksum 0xe591 (incorrect -> 0xbe68), ack 1990, win 63, options [nop,nop,TS val 2058721879 ecr 3825242810], length 0
18:35:20.689924 IP (tos 0x0, ttl 64, id 26070, offset 0, flags [DF], proto TCP (6), length 56)
    192.168.50.23.554 > 192.168.50.3.55448: Flags [P.], cksum 0x90a9 (correct), seq 1990:1994, ack 1599, win 2003, options [nop,nop,TS val 3825243320 ecr 2058721879], length 4: RTSP
```

### ffprobe output

```
Input #0, rtsp, from 'rtsp://admin:myredactedpass@192.168.50.23:554/h264Preview_01_sub':
  Metadata:
    title           : Session streamed by "preview"
    comment         : reolink rtsp stream
  Duration: N/A, start: -0.005188, bitrate: N/A
  Stream #0:0: Video: h264 (High), yuv420p(progressive), 1536x432, 20 fps, 25 tbr, 90k tbn, start 0.038844
  Stream #0:1: Audio: aac (LC), 16000 Hz, mono, fltp, start -0.005188
```
